{
  "resourceId": "pinecrest/customer-orders-daily",
  "versionId": "1.1.0",
  "parentVersionId": "1.0.0",
  "mutationType": "update",
  "commitId": "urn:pinecrest:commit:01HZBBBB00000000000000000B",
  "createdAt": "2026-05-06T15:00:06Z",
  "changeSummary": "Schema evolution from 1.0.0 to 1.1.0 — non-breaking column add (customer_segment, string, nullable). Composition dependencies unchanged on the resource-entity (still pinned to customer-master@v3 and order-events-stream@v7); this lineage node carries only the standard version-lineage fields.",
  "restoredFromVersionId": null,
  "supersedesVersionId": null
}
